{
  "case_id": "BDC-BND-0001",
  "version": 1,
  "task": "ANSWER_BINDING",
  "language_bucket": "en-NG",
  "generator": {
    "name": "noema-casegen-decisions",
    "version": "0.1.0",
    "seed": 7
  },
  "input": {
    "channel": "text",
    "text": "the 8 o'clock one",
    "context": {
      "options": [
        {
          "id": "opt_1",
          "label": "08:10, NGN 20,000, ending 4821"
        },
        {
          "id": "opt_2",
          "label": "14:30, NGN 20,000, ending 7710"
        }
      ]
    }
  },
  "question": {
    "id": "answer_binding",
    "type": "choice",
    "prompt": "Which option does the answer select?",
    "options": [
      "opt_1",
      "opt_2",
      "none"
    ]
  },
  "expected": "opt_1",
  "perturbations": [
    {
      "kind": "WHITESPACE",
      "text": "the  8 o'clock   one"
    }
  ],
  "provenance": "generated"
}
